<?xml version="1.0" ?>
<LexicalResource xmlns="https://www.ortolang.fr/market/lexicons/prolex/v4.1" xmlns:xsi="http://www.w3.org/2001/XMLSchema-instance" xsi:schemaLocation="https://www.ortolang.fr/market/lexicons/prolex/v4.1/ ProLMF_4.xsd">
    <GlobalInformation languageCoding="ISO 639" scriptCoding="ISO 15924" characterCoding="UTF-8" entrySource="Prolexbase" resourceName="ProLMF" version="4.1"/>
    <Lexicon languageIdentifier="arb" script="arab">
        <LexicalEntry partOfSpeech="adjective">
            <Lemma>مارتينيك</Lemma>
            <WordForm grammaticalGender="feminine" grammaticalNumber="singular" grammaticalCase="nominative" grammaticalDefiniteness="definite">
                <FormRepresentation>المارتينيكية</FormRepresentation>
            </WordForm>
            <WordForm grammaticalGender="feminine" grammaticalNumber="singular" grammaticalCase="nominative" grammaticalDefiniteness="definite">
                <FormRepresentation>مارتينيكيةُ</FormRepresentation>
            </WordForm>
            <WordForm grammaticalGender="feminine" grammaticalNumber="singular" grammaticalCase="nominative" grammaticalDefiniteness="indefinite">
                <FormRepresentation>مارتينيكية</FormRepresentation>
            </WordForm>
            <WordForm grammaticalGender="feminine" grammaticalNumber="singular" grammaticalCase="nominative" grammaticalDefiniteness="indefinite">
                <FormRepresentation>مارتينيكيةٌ</FormRepresentation>
            </WordForm>
            <WordForm grammaticalGender="feminine" grammaticalNumber="singular" grammaticalCase="accusative" grammaticalDefiniteness="definite">
                <FormRepresentation>مارتينيكيةَ</FormRepresentation>
            </WordForm>
            <WordForm grammaticalGender="feminine" grammaticalNumber="singular" grammaticalCase="accusative" grammaticalDefiniteness="indefinite">
                <FormRepresentation>مارتينيكيةً</FormRepresentation>
            </WordForm>
            <WordForm grammaticalGender="feminine" grammaticalNumber="singular" grammaticalCase="genitive" grammaticalDefiniteness="definite">
                <FormRepresentation>مارتينيكيةِ</FormRepresentation>
            </WordForm>
            <WordForm grammaticalGender="feminine" grammaticalNumber="singular" grammaticalCase="genitive" grammaticalDefiniteness="indefinite">
                <FormRepresentation>مارتينيكيةٍ</FormRepresentation>
            </WordForm>
            <WordForm grammaticalGender="feminine" grammaticalNumber="dual" grammaticalCase="nominative" grammaticalDefiniteness="definite">
                <FormRepresentation>المارتينيكيتانِ</FormRepresentation>
            </WordForm>
            <WordForm grammaticalGender="feminine" grammaticalNumber="dual" grammaticalCase="nominative" grammaticalDefiniteness="indefinite">
                <FormRepresentation>مارتينيكيتانِ</FormRepresentation>
            </WordForm>
            <WordForm grammaticalGender="feminine" grammaticalNumber="dual" grammaticalCase="accusative" grammaticalDefiniteness="definite">
                <FormRepresentation>المارتينيكيتَينِ</FormRepresentation>
            </WordForm>
            <WordForm grammaticalGender="feminine" grammaticalNumber="dual" grammaticalCase="accusative" grammaticalDefiniteness="indefinite">
                <FormRepresentation>مارتينيكيتَينِ</FormRepresentation>
            </WordForm>
            <WordForm grammaticalGender="feminine" grammaticalNumber="dual" grammaticalCase="genitive" grammaticalDefiniteness="definite">
                <FormRepresentation>المارتينيكيتَينِ</FormRepresentation>
            </WordForm>
            <WordForm grammaticalGender="feminine" grammaticalNumber="dual" grammaticalCase="genitive" grammaticalDefiniteness="indefinite">
                <FormRepresentation>مارتينيكيتَينِ</FormRepresentation>
            </WordForm>
            <WordForm grammaticalGender="feminine" grammaticalNumber="plural" grammaticalCase="nominative" grammaticalDefiniteness="definite">
                <FormRepresentation>المارتينيكيات</FormRepresentation>
            </WordForm>
            <WordForm grammaticalGender="feminine" grammaticalNumber="plural" grammaticalCase="nominative" grammaticalDefiniteness="indefinite">
                <FormRepresentation>مارتينيكيات</FormRepresentation>
            </WordForm>
            <WordForm grammaticalGender="feminine" grammaticalNumber="plural" grammaticalCase="accusative" grammaticalDefiniteness="indefinite">
                <FormRepresentation>مارتينيكيٌّ</FormRepresentation>
            </WordForm>
            <WordForm grammaticalGender="masculine" grammaticalNumber="singular" grammaticalCase="nominative" grammaticalDefiniteness="definite">
                <FormRepresentation>المارتينيكي</FormRepresentation>
            </WordForm>
            <WordForm grammaticalGender="masculine" grammaticalNumber="singular" grammaticalCase="nominative" grammaticalDefiniteness="definite">
                <FormRepresentation>المارتينيكيُّ</FormRepresentation>
            </WordForm>
            <WordForm grammaticalGender="masculine" grammaticalNumber="singular" grammaticalCase="nominative" grammaticalDefiniteness="indefinite">
                <FormRepresentation>مارتينيكي</FormRepresentation>
            </WordForm>
            <WordForm grammaticalGender="masculine" grammaticalNumber="singular" grammaticalCase="accusative" grammaticalDefiniteness="definite">
                <FormRepresentation>مارتينيكيَّ</FormRepresentation>
            </WordForm>
            <WordForm grammaticalGender="masculine" grammaticalNumber="singular" grammaticalCase="accusative" grammaticalDefiniteness="indefinite">
                <FormRepresentation>مارتينيكيًّا</FormRepresentation>
            </WordForm>
            <WordForm grammaticalGender="masculine" grammaticalNumber="singular" grammaticalCase="genitive" grammaticalDefiniteness="definite">
                <FormRepresentation>مارتينيكيِّ</FormRepresentation>
            </WordForm>
            <WordForm grammaticalGender="masculine" grammaticalNumber="singular" grammaticalCase="genitive" grammaticalDefiniteness="indefinite">
                <FormRepresentation>مارتينيكيٍّ</FormRepresentation>
            </WordForm>
            <WordForm grammaticalGender="masculine" grammaticalNumber="dual" grammaticalCase="nominative" grammaticalDefiniteness="indefinite">
                <FormRepresentation>مارتينيكيانِ</FormRepresentation>
            </WordForm>
            <WordForm grammaticalGender="masculine" grammaticalNumber="plural" grammaticalCase="nominative" grammaticalDefiniteness="definite">
                <FormRepresentation>المارتينيكيانِ</FormRepresentation>
            </WordForm>
            <WordForm grammaticalGender="masculine" grammaticalNumber="plural" grammaticalCase="accusative" grammaticalDefiniteness="definite">
                <FormRepresentation>المارتينيكيون</FormRepresentation>
            </WordForm>
            <WordForm grammaticalGender="masculine" grammaticalNumber="plural" grammaticalCase="accusative" grammaticalDefiniteness="indefinite">
                <FormRepresentation>مارتينيكيون</FormRepresentation>
            </WordForm>
            <Sense idSense="D1" refSenseAxis="2" termProvenance="" label="derivative" refSense="P19527">
                <MonolingualExternalRef externalReference="2023" frequency="unfrequentlyUsed"/>
                <MonolingualExternalRef externalReference="2022" frequency="unfrequentlyUsed"/>
                <MonolingualExternalRef externalReference="2021" frequency="unfrequentlyUsed"/>
                <MonolingualExternalRef externalReference="2020" frequency="unfrequentlyUsed"/>
                <MonolingualExternalRef externalReference="2019" frequency="unfrequentlyUsed"/>
                <MonolingualExternalRef externalSystem="Wikipedia" externalReference="https://ar.wikipedia.org/wiki/مارتينيك"/>
                <SyntacticBehaviour refSubcategorizationFrame="CO1"/>
            </Sense>
        </LexicalEntry>
        <LexicalEntry partOfSpeech="noun">
            <Lemma>إيل دو فرانس</Lemma>
            <WordForm grammaticalGender="feminine" grammaticalNumber="singular" grammaticalCase="nominative" grammaticalDefiniteness="indefinite">
                <FormRepresentation>إيل دو فرانس</FormRepresentation>
            </WordForm>
            <Sense idSense="D2" refSenseAxis="5" termProvenance="" label="derivative" refSense="P19528">
                <MonolingualExternalRef externalReference="2023" frequency="rarelyUsed"/>
                <MonolingualExternalRef externalReference="2022" frequency="rarelyUsed"/>
                <MonolingualExternalRef externalReference="2021" frequency="rarelyUsed"/>
                <MonolingualExternalRef externalReference="2020" frequency="rarelyUsed"/>
                <MonolingualExternalRef externalReference="2019" frequency="rarelyUsed"/>
                <MonolingualExternalRef externalSystem="Wikipedia" externalReference="https://ar.wikipedia.org/wiki/إيل_دو_فرانس"/>
                <SyntacticBehaviour refSubcategorizationFrame="CO1"/>
            </Sense>
        </LexicalEntry>
        <LexicalEntry partOfSpeech="noun">
            <Lemma>سانتر-فال دو لوار</Lemma>
            <WordForm grammaticalGender="feminine" grammaticalNumber="singular" grammaticalCase="nominative" grammaticalDefiniteness="indefinite">
                <FormRepresentation>سانتر-فال دو لوار</FormRepresentation>
            </WordForm>
            <Sense idSense="D3" refSenseAxis="9" termProvenance="" label="derivative" refSense="P19529">
                <MonolingualExternalRef externalReference="2023" frequency="rarelyUsed"/>
                <MonolingualExternalRef externalReference="2022" frequency="rarelyUsed"/>
                <MonolingualExternalRef externalReference="2021" frequency="rarelyUsed"/>
                <MonolingualExternalRef externalReference="2020" frequency="rarelyUsed"/>